{
  "masterPlanVersion": "2.1.1",
  "currentPhase": "P0",
  "currentWorkPackage": "P0-W04A",
  "activeAgent": "codex",
  "activeWorktree": "C:\\Pantheon-worktrees\\P0-engineering-os",
  "sessionOutcome": "in_progress",
  "updatedAt": "2026-08-16T13:38:15+10:00",
  "phases": [
    {
      "id": "P0",
      "name": "V2.1.1 engineering operating system",
      "status": "in_progress",
      "executionPack": "docs/v2/phases/P0-EXECUTION-PACK.md",
      "workPackages": [
        {
          "id": "P0-W01",
          "title": "Preserve WIP and establish the clean Phase 0 baseline",
          "status": "complete",
          "preferredAgent": "codex",
          "handoffAllowed": true,
          "evidence": [
            "docs/v2/phases/P0-EXECUTION-PACK.md",
            "docs/v2/evidence/packages/P0-W01/COMPLETION.md"
          ],
          "blockers": [],
          "commits": [
            "612a35c8b1d881f638570373d06f99d26bfb280e",
            "c6fe4380f9480d885446599bcbb4f0ccffa028a2"
          ]
        },
        {
          "id": "P0-W02",
          "title": "Reconcile programme authority and the cross-agent contract",
          "status": "complete",
          "preferredAgent": "codex",
          "handoffAllowed": true,
          "evidence": [
            "docs/v2/phases/P0-EXECUTION-PACK.md",
            "docs/v2/decisions/ADR-0001-P0-EXECUTION-CONTRACT.md",
            "docs/v2/evidence/packages/P0-W02/COMPLETION.md"
          ],
          "blockers": [],
          "commits": [
            "3233aae17fa06c075d43c1c181a5502527ebf8c6"
          ]
        },
        {
          "id": "P0-W03",
          "title": "Add lightweight continuity tooling",
          "status": "complete",
          "preferredAgent": "codex",
          "handoffAllowed": true,
          "evidence": [
            "docs/v2/phases/P0-EXECUTION-PACK.md",
            "docs/v2/evidence/packages/P0-W03/COMPLETION.md"
          ],
          "blockers": [],
          "commits": [
            "9c29d19b140c648f8100605b6479f790320be695"
          ]
        },
        {
          "id": "P0-W04",
          "title": "Harden tests and rehearse fresh-session continuity",
          "status": "complete",
          "preferredAgent": "codex",
          "handoffAllowed": true,
          "evidence": [
            "docs/v2/phases/P0-EXECUTION-PACK.md",
            "docs/v2/work-packages/P0-W04.md",
            "docs/v2/work-packages/P0-W04-A01-DISPOSABLE-RENDERER-AMENDMENT.md",
            "docs/v2/decisions/ADR-0002-NEXT-SESSION-PROMPT-CONTRACT.md",
            "docs/v2/evidence/packages/P0-W04/CHECKPOINT.md",
            "docs/v2/evidence/packages/P0-W04/COMPLETION.md"
          ],
          "blockers": [],
          "commits": [
            "acd466410154049bfcb207a5bc85416c999517b1",
            "e88ed00ef0d204e0a33b8a9a4467a8be8657f42d",
            "1303ce5149c4a5a4ecdb1e93b234b58782f8d16f"
          ]
        },
        {
          "id": "P0-W04A",
          "title": "Renderer Environment and Gate Corrections",
          "status": "in_progress",
          "preferredAgent": "codex",
          "handoffAllowed": true,
          "evidence": [
            "docs/v2/work-packages/P0-W04A.md",
            "docs/v2/evidence/phases/P0/PHASE-GATE-REVIEW.md"
          ],
          "blockers": [],
          "commits": []
        },
        {
          "id": "P0-W05",
          "title": "Independent Phase 0 gate and owner-approved integration",
          "status": "backlog",
          "preferredAgent": "either",
          "handoffAllowed": true,
          "evidence": [
            "docs/v2/evidence/phases/P0/PHASE-GATE-REVIEW.md"
          ],
          "blockers": [
            "P0-B03",
            "P0-B04"
          ],
          "commits": [
            "75914d954cbf78b7bf4695eed2f135ea1bb627ac"
          ]
        }
      ]
    },
    {
      "id": "P1",
      "name": "Stable application facade and live event stream",
      "status": "backlog",
      "executionPack": null,
      "workPackages": []
    },
    {
      "id": "P2",
      "name": "Owner Control Plane v2",
      "status": "backlog",
      "executionPack": null,
      "workPackages": []
    },
    {
      "id": "P3",
      "name": "Modular monolith refactor",
      "status": "backlog",
      "executionPack": null,
      "workPackages": []
    },
    {
      "id": "P4",
      "name": "Capability Fabric and provider qualification",
      "status": "backlog",
      "executionPack": null,
      "workPackages": []
    },
    {
      "id": "P5",
      "name": "Dynamic Venture OS and agent teams",
      "status": "backlog",
      "executionPack": null,
      "workPackages": []
    },
    {
      "id": "P6",
      "name": "Opportunity and research intelligence",
      "status": "backlog",
      "executionPack": null,
      "workPackages": []
    },
    {
      "id": "P7",
      "name": "Creative, product and web factory",
      "status": "backlog",
      "executionPack": null,
      "workPackages": []
    },
    {
      "id": "P8",
      "name": "Commerce, customer, analytics and finance",
      "status": "backlog",
      "executionPack": null,
      "workPackages": []
    },
    {
      "id": "P9",
      "name": "Continuous learning and earned autonomy",
      "status": "backlog",
      "executionPack": null,
      "workPackages": []
    },
    {
      "id": "P10",
      "name": "First commercial viability programme",
      "status": "backlog",
      "executionPack": null,
      "workPackages": []
    },
    {
      "id": "P11",
      "name": "Repeatability, parallelism and second Venture Kit",
      "status": "backlog",
      "executionPack": null,
      "workPackages": []
    }
  ]
}
